{
  "schema": "nogra.run.event.v2",
  "eventId": "run-event-run-20260723-example-run_queued-2",
  "eventType": "run_queued",
  "type": "run_queued",
  "workspaceId": "example-workspace",
  "runId": "run-20260723-example",
  "briefId": "brief-example",
  "approvalId": "approval-20260723-example",
  "approvalActionHash": "sha256:bbbbbbbbbbbbbbbbbbbbbbbbbbbbbbbbbbbbbbbbbbbbbbbbbbbbbbbbbbbbbbbb",
  "lifecycle": "queued",
  "outcome": null,
  "verdict": null,
  "ledgerWatermark": 2,
  "createdAt": "2026-07-23T10:00:01.000Z",
  "generatedAt": "2026-07-23T10:00:01.000Z",
  "sessionId": "",
  "transcriptId": "",
  "summary": "",
  "executionRole": "nogra:executor",
  "executionRuntime": "sonnet",
  "nextOwner": "nogra:executor"
}
